{
  "stateVersion": 3,
  "revision": 4,
  "workflowId": "wf-baton-fixture",
  "slug": "baton-fixture",
  "workflowType": "lite",
  "status": "active",
  "currentStep": 3,
  "completedSteps": [0, 1, 2],
  "skippedSteps": [],
  "stepStatus": { "0": "completed", "1": "completed", "2": "completed" },
  "handoffs": {
    "2": {
      "step": 2,
      "slug": "baton-fixture",
      "workflowId": "wf-baton-fixture",
      "workflowType": "lite",
      "status": "completed",
      "artifactPaths": [],
      "acRefs": [],
      "summary": "Fixture prior handoff",
      "nextAction": "Run step 3",
      "findings": { "critical": 0, "warning": 0, "suggestion": 0, "info": 0 }
    }
  }
}
